{
  "schemaVersion": 2,
  "id": "google-gemini-2025-11-10-imagen-3-0-generate-002",
  "subject": {
    "kind": "model",
    "name": "imagen-3.0-generate-002",
    "provider": "google-gemini"
  },
  "kind": "model-retirement",
  "title": "imagen-3.0-generate-002 shutdown",
  "summary": "Imagen models. Shutdown date: 2025-11-10. Replacement: gemini-nano-banana-2.1.",
  "applicability": {
    "class": "already-broken",
    "fixedIn": [],
    "announcedOn": null,
    "effectiveOn": "2025-11-10"
  },
  "signatures": [
    {
      "kind": "string-literal",
      "value": "imagen-3.0-generate-002",
      "context": "llm-call-arg"
    }
  ],
  "replacement": {
    "value": "gemini-nano-banana-2.1",
    "modelIds": ["gemini-nano-banana-2.1"],
    "codemod": {
      "kind": "model-swap",
      "spec": {
        "from": ["imagen-3.0-generate-002"],
        "to": "gemini-nano-banana-2.1"
      }
    }
  },
  "migrationNotes": [],
  "sources": [
    {
      "url": "https://ai.google.dev/gemini-api/docs/deprecations.md.txt",
      "kind": "provider-table",
      "trustBasis": "official-domain",
      "quote": "| `imagen-3.0-generate-002` | February 6, 2025 | November 10, 2025 | `gemini-nano-banana-2.1` |",
      "contentHash": "3342ebac18090931abc3a2f58e42a07f2f1f4c7f411dc6587c4faf64831c4601",
      "checkedAt": "2026-10-25T01:15:36.779Z"
    }
  ],
  "provenance": {
    "method": "table",
    "confidence": {
      "overall": 1
    }
  },
  "visibility": "public",
  "status": "confirmed",
  "quarantineReasons": []
}
