{
  "schemaVersion": 2,
  "id": "google-gemini-2025-12-02-gemini-2-5-pro-preview-05-06",
  "subject": {
    "kind": "model",
    "name": "gemini-2.5-pro-preview-05-06",
    "provider": "google-gemini"
  },
  "kind": "model-retirement",
  "title": "gemini-2.5-pro-preview-05-06 shutdown",
  "summary": "Gemini 2.5 Pro models. Shutdown date: 2025-12-02. Replacement: gemini-3.1-pro-preview.",
  "applicability": {
    "class": "already-broken",
    "fixedIn": [],
    "announcedOn": null,
    "effectiveOn": "2025-12-02"
  },
  "signatures": [
    {
      "kind": "string-literal",
      "value": "gemini-2.5-pro-preview-05-06",
      "context": "llm-call-arg"
    }
  ],
  "replacement": {
    "value": "gemini-3.1-pro-preview",
    "modelIds": ["gemini-3.1-pro-preview"],
    "codemod": {
      "kind": "model-swap",
      "spec": {
        "from": ["gemini-2.5-pro-preview-05-06"],
        "to": "gemini-3.1-pro-preview"
      }
    }
  },
  "migrationNotes": [],
  "sources": [
    {
      "url": "https://ai.google.dev/gemini-api/docs/deprecations.md.txt",
      "kind": "provider-table",
      "trustBasis": "official-domain",
      "quote": "| `gemini-2.5-pro-preview-05-06` | May 6, 2025 | December 2, 2025 | `gemini-3.1-pro-preview` |",
      "contentHash": "3342ebac18090931abc3a2f58e42a07f2f1f4c7f411dc6587c4faf64831c4601",
      "checkedAt": "2026-10-25T01:15:36.779Z"
    }
  ],
  "provenance": {
    "method": "table",
    "confidence": {
      "overall": 1
    }
  },
  "visibility": "public",
  "status": "confirmed",
  "quarantineReasons": []
}
