{
  "schemaVersion": 2,
  "id": "openai-2027-04-01-gpt-5-3-codex",
  "subject": {
    "kind": "model",
    "name": "gpt-5.3-codex",
    "provider": "openai"
  },
  "kind": "model-retirement",
  "title": "gpt-5.3-codex shutdown",
  "summary": "GPT-5.3-Codex, GPT-5.1, GPT-5.4-Nano. Shutdown date: 2027-04-01. Replacement: gpt-6-sol.",
  "applicability": {
    "class": "breaks-on-date",
    "fixedIn": [],
    "announcedOn": "2026-10-01",
    "effectiveOn": "2027-04-01"
  },
  "signatures": [
    {
      "kind": "string-literal",
      "value": "gpt-5.3-codex",
      "context": "llm-call-arg"
    }
  ],
  "replacement": {
    "value": "gpt-6-sol",
    "modelIds": ["gpt-6-sol"],
    "codemod": {
      "kind": "model-swap",
      "spec": {
        "from": ["gpt-5.3-codex"],
        "to": "gpt-6-sol"
      }
    }
  },
  "migrationNotes": [],
  "sources": [
    {
      "url": "https://developers.openai.com/api/docs/deprecations.md",
      "kind": "provider-table",
      "trustBasis": "official-domain",
      "quote": "| Apr 1, 2027   | `gpt-5.3-codex`                             | `gpt-6-sol`             |",
      "contentHash": "b5d1cafefc8a491f2c095d77359a6ca185498baa5f65a66bac1cb722e188855f",
      "checkedAt": "2026-10-25T01:15:35.314Z"
    }
  ],
  "provenance": {
    "method": "table",
    "confidence": {
      "overall": 1
    }
  },
  "visibility": "public",
  "status": "confirmed",
  "quarantineReasons": []
}
