{
  "schemaVersion": 2,
  "id": "openai-2026-09-24-sora-2-pro",
  "subject": {
    "kind": "model",
    "name": "sora-2-pro",
    "provider": "openai"
  },
  "kind": "model-retirement",
  "title": "sora-2-pro shutdown",
  "summary": "Sora 2 video generation models and Videos API. Shutdown date: 2026-09-24. Replacement: ---.",
  "applicability": {
    "class": "already-broken",
    "fixedIn": [],
    "announcedOn": "2026-03-24",
    "effectiveOn": "2026-09-24"
  },
  "signatures": [
    {
      "kind": "string-literal",
      "value": "sora-2-pro",
      "context": "llm-call-arg"
    }
  ],
  "replacement": {
    "value": "---",
    "modelIds": []
  },
  "migrationNotes": [],
  "sources": [
    {
      "url": "https://developers.openai.com/api/docs/deprecations.md",
      "kind": "provider-table",
      "trustBasis": "official-domain",
      "quote": "| 2026-09-24    | `sora-2-pro`            | ---                     |",
      "contentHash": "b5d1cafefc8a491f2c095d77359a6ca185498baa5f65a66bac1cb722e188855f",
      "checkedAt": "2026-10-25T01:15:35.314Z"
    }
  ],
  "provenance": {
    "method": "table",
    "confidence": {
      "overall": 1
    }
  },
  "visibility": "public",
  "status": "confirmed",
  "quarantineReasons": []
}
