{
  "schemaVersion": 2,
  "id": "openai-2024-01-04-curie",
  "subject": {
    "kind": "model",
    "name": "curie",
    "provider": "openai"
  },
  "kind": "model-retirement",
  "title": "curie shutdown",
  "summary": "GPT and embeddings. Shutdown date: 2024-01-04. Replacement: davinci-002.",
  "applicability": {
    "class": "already-broken",
    "fixedIn": [],
    "announcedOn": "2023-07-06",
    "effectiveOn": "2024-01-04"
  },
  "signatures": [
    {
      "kind": "string-literal",
      "value": "curie",
      "context": "llm-call-arg"
    }
  ],
  "replacement": {
    "value": "davinci-002",
    "modelIds": ["davinci-002"],
    "codemod": {
      "kind": "model-swap",
      "spec": {
        "from": ["curie"],
        "to": "davinci-002"
      }
    }
  },
  "migrationNotes": [],
  "sources": [
    {
      "url": "https://developers.openai.com/api/docs/deprecations.md",
      "kind": "provider-table",
      "trustBasis": "official-domain",
      "quote": "| 2024-01-04    | `curie`            | $2.00 / 1M tokens      | `davinci-002`            |",
      "contentHash": "b5d1cafefc8a491f2c095d77359a6ca185498baa5f65a66bac1cb722e188855f",
      "checkedAt": "2026-10-25T01:15:35.314Z"
    },
    {
      "url": "https://developers.openai.com/api/docs/deprecations.md",
      "kind": "provider-table",
      "trustBasis": "official-domain",
      "quote": "| 2024-01-04    | `curie`          | $3.00 / 1M tokens  | $12.00 / 1M tokens  | `davinci-002`                            |",
      "contentHash": "b5d1cafefc8a491f2c095d77359a6ca185498baa5f65a66bac1cb722e188855f",
      "checkedAt": "2026-10-25T01:15:35.314Z"
    }
  ],
  "provenance": {
    "method": "table",
    "confidence": {
      "overall": 1
    }
  },
  "visibility": "public",
  "status": "confirmed",
  "quarantineReasons": []
}
