{
  "schemaVersion": 2,
  "id": "stripe-2026-09-30-endive-blik-granular-decline-codes",
  "subject": {
    "kind": "api-host",
    "name": "api.stripe.com",
    "provider": "stripe"
  },
  "kind": "behaviour-change",
  "title": "Returns specific decline codes for BLIK payment failures",
  "summary": "Replaces the generic_decline decline code with code_invalid, code_expired, insufficient_funds, customer_declined, payment_limit_exceeded, and partner_generic_decline for applicable BLIK payment failures. Integrations with strict decline-code handling must accept code_invalid, code_expired, insufficient_funds, customer_declined, payment_limit_exceeded, and partner_generic_decline. Previously, API versions before Endive received generic_decline.",
  "applicability": {
    "class": "breaks-on-upgrade",
    "fixedIn": [],
    "apiVersion": {
      "header": "Stripe-Version",
      "to": "2026-09-30.endive"
    },
    "announcedOn": "2026-09-30",
    "effectiveOn": null
  },
  "signatures": [],
  "replacement": null,
  "migrationNotes": [
    {
      "text": "You now receive specific decline codes for applicable BLIK payment failures. Update your error handling to support code_invalid, code_expired, insufficient_funds, customer_declined, payment_limit_exceeded, and partner_generic_decline. For details about these decline codes, see decline codes.",
      "sourceIndex": 0
    }
  ],
  "sources": [
    {
      "url": "https://docs.stripe.com/changelog.md",
      "kind": "changelog",
      "trustBasis": "official-domain",
      "quote": "| [Returns specific decline codes for BLIK payment failures](https://docs.stripe.com/changelog/endive/2026-09-30/blik-granular-decline-codes.md) | Payments | Breaking | api |",
      "contentHash": "0eef16b7bc6e9c3ce878cc105d526a425e55660bf3eaf3cdfc9a4f4b8980c103",
      "checkedAt": "2026-10-25T01:15:38.993Z"
    },
    {
      "url": "https://docs.stripe.com/changelog/endive/2026-09-30/blik-granular-decline-codes.md",
      "kind": "changelog",
      "trustBasis": "official-domain",
      "quote": "Integrations with strict decline-code handling must accept `code_invalid`, `code_expired`, `insufficient_funds`, `customer_declined`, `payment_limit_exceeded`, and `partner_generic_decline`. Previously, API versions before Endive received `generic_decline`.",
      "contentHash": "82bcbdd6853f188c6fcc3359431cb2388223077372c09abd804ac39fac60e633",
      "checkedAt": "2026-10-25T01:15:41.916Z"
    }
  ],
  "provenance": {
    "method": "table",
    "confidence": {
      "overall": 1
    }
  },
  "visibility": "public",
  "status": "confirmed",
  "quarantineReasons": []
}
