{
  "schemaVersion": 2,
  "id": "stripe-2020-08-27-v-removes-tax-percent-attribute",
  "subject": {
    "kind": "api-host",
    "name": "api.stripe.com",
    "provider": "stripe"
  },
  "kind": "parameter-change",
  "title": "Removes the `tax_percent` attribute",
  "summary": "Removes tax_percent from objects and requests in favor of tax rates.",
  "applicability": {
    "class": "breaks-on-upgrade",
    "fixedIn": [],
    "apiVersion": {
      "header": "Stripe-Version",
      "to": "2020-08-27"
    },
    "announcedOn": "2020-08-27",
    "effectiveOn": null
  },
  "signatures": [],
  "replacement": null,
  "migrationNotes": [
    {
      "text": "Lets you manage taxation more flexibly by using the dedicated Tax Rates API instead of the previously available tax_percent property.",
      "sourceIndex": 0
    }
  ],
  "sources": [
    {
      "url": "https://docs.stripe.com/changelog.md",
      "kind": "changelog",
      "trustBasis": "official-domain",
      "quote": "| [Removes the `tax_percent` attribute](https://docs.stripe.com/changelog/2020-08-27/removes-tax-percent-attribute.md) | Checkout, Billing, Invoicing | Breaking | api |",
      "contentHash": "0eef16b7bc6e9c3ce878cc105d526a425e55660bf3eaf3cdfc9a4f4b8980c103",
      "checkedAt": "2026-10-25T01:15:38.993Z"
    },
    {
      "url": "https://docs.stripe.com/changelog/2020-08-27/removes-tax-percent-attribute.md",
      "kind": "changelog",
      "trustBasis": "official-domain",
      "quote": "Removes `tax_percent` from objects and requests in favor of [tax rates](https://docs.stripe.com/api/tax_rates.md?api-version=2024-06-20).",
      "contentHash": "7db6e3f50d49af069fc44691287d61e319da7b5ee60a2b3a19c69728630196c5",
      "checkedAt": "2026-10-25T01:15:48.587Z"
    }
  ],
  "provenance": {
    "method": "table",
    "confidence": {
      "overall": 1
    }
  },
  "visibility": "public",
  "status": "confirmed",
  "quarantineReasons": []
}
