{
  "schemaVersion": 2,
  "id": "openai-2024-01-04-code-davinci-002",
  "subject": {
    "kind": "model",
    "name": "code-davinci-002",
    "provider": "openai"
  },
  "kind": "model-retirement",
  "title": "code-davinci-002 shutdown",
  "summary": "GPT and embeddings. Shutdown date: 2024-01-04. Replacement: gpt-3.5-turbo-instruct.",
  "applicability": {
    "class": "already-broken",
    "fixedIn": [],
    "announcedOn": "2023-07-06",
    "effectiveOn": "2024-01-04"
  },
  "signatures": [
    {
      "kind": "string-literal",
      "value": "code-davinci-002",
      "context": "llm-call-arg"
    }
  ],
  "replacement": {
    "value": "gpt-3.5-turbo-instruct",
    "modelIds": ["gpt-3.5-turbo-instruct"],
    "codemod": {
      "kind": "model-swap",
      "spec": {
        "from": ["code-davinci-002"],
        "to": "gpt-3.5-turbo-instruct"
      }
    }
  },
  "migrationNotes": [],
  "sources": [
    {
      "url": "https://developers.openai.com/api/docs/deprecations.md",
      "kind": "provider-table",
      "trustBasis": "official-domain",
      "quote": "| 2024-01-04    | `code-davinci-002` | ---                    | `gpt-3.5-turbo-instruct` |",
      "contentHash": "b5d1cafefc8a491f2c095d77359a6ca185498baa5f65a66bac1cb722e188855f",
      "checkedAt": "2026-10-25T01:15:35.314Z"
    }
  ],
  "provenance": {
    "method": "table",
    "confidence": {
      "overall": 1
    }
  },
  "visibility": "public",
  "status": "confirmed",
  "quarantineReasons": []
}
