{
  "schemaVersion": 2,
  "id": "google-gemini-2026-11-17-gemini-3-1-flash-live-preview",
  "subject": {
    "kind": "model",
    "name": "gemini-3.1-flash-live-preview",
    "provider": "google-gemini"
  },
  "kind": "model-retirement",
  "title": "gemini-3.1-flash-live-preview shutdown",
  "summary": "Live API models. Shutdown date: 2026-11-17. Replacement: gemini-3.8-live.",
  "applicability": {
    "class": "breaks-on-date",
    "fixedIn": [],
    "announcedOn": null,
    "effectiveOn": "2026-11-17"
  },
  "signatures": [
    {
      "kind": "string-literal",
      "value": "gemini-3.1-flash-live-preview",
      "context": "llm-call-arg"
    }
  ],
  "replacement": {
    "value": "gemini-3.8-live",
    "modelIds": ["gemini-3.8-live"],
    "codemod": {
      "kind": "model-swap",
      "spec": {
        "from": ["gemini-3.1-flash-live-preview"],
        "to": "gemini-3.8-live"
      }
    }
  },
  "migrationNotes": [],
  "sources": [
    {
      "url": "https://ai.google.dev/gemini-api/docs/deprecations.md.txt",
      "kind": "provider-table",
      "trustBasis": "official-domain",
      "quote": "| `gemini-3.1-flash-live-preview` | March 11, 2026 | November 17, 2026 | `gemini-3.8-live` |",
      "contentHash": "3342ebac18090931abc3a2f58e42a07f2f1f4c7f411dc6587c4faf64831c4601",
      "checkedAt": "2026-10-25T01:15:36.779Z"
    }
  ],
  "provenance": {
    "method": "table",
    "confidence": {
      "overall": 1
    }
  },
  "visibility": "public",
  "status": "confirmed",
  "quarantineReasons": []
}
