{
  "schemaVersion": 2,
  "id": "stripe-2026-09-30-endive-polymorphic-billing-cycle-anchor",
  "subject": {
    "kind": "api-host",
    "name": "api.stripe.com",
    "provider": "stripe"
  },
  "kind": "parameter-change",
  "title": "Unifies the billing cycle anchor format across Subscriptions and Invoices",
  "summary": "Unifies how updates to a subscription’s billing cycle anchor are formatted when updating Subscriptions, resuming Subscriptions, and creating Preview Invoices. The billing_cycle_anchor field now uses a consistent object format with a type field, replacing the previous string, enum, and timestamp formats. The billing_cycle_anchor field now requires an object with a type field instead of a string value (for example, {type: 'now'}). When creating a preview invoice, the subscription_details.billing_cycle_anchor field requires an object with type and timestamp fields.",
  "applicability": {
    "class": "breaks-on-upgrade",
    "fixedIn": [],
    "apiVersion": {
      "header": "Stripe-Version",
      "to": "2026-09-30.endive"
    },
    "announcedOn": "2026-09-30",
    "effectiveOn": null
  },
  "signatures": [],
  "replacement": null,
  "migrationNotes": [
    {
      "text": "Previously, you could pass a string value when updating a subscription’s billing cycle anchor. Instead, set billing_cycle_anchor to an object with an equivalent type parameter.",
      "sourceIndex": 0
    },
    {
      "text": "Replace now with {type: 'now'}.",
      "sourceIndex": 0
    },
    {
      "text": "Replace unchanged with {type: 'unchanged'}.",
      "sourceIndex": 0
    },
    {
      "text": "When creating a preview invoice for a new subscription whose billing cycle anchor is a future timestamp, replace 1234567890 with {type: 'timestamp', timestamp: 1234567890}.",
      "sourceIndex": 0
    }
  ],
  "sources": [
    {
      "url": "https://docs.stripe.com/changelog.md",
      "kind": "changelog",
      "trustBasis": "official-domain",
      "quote": "| [Unifies the billing cycle anchor format across Subscriptions and Invoices](https://docs.stripe.com/changelog/endive/2026-09-30/polymorphic-billing-cycle-anchor.md) | Billing | Breaking | api |",
      "contentHash": "0eef16b7bc6e9c3ce878cc105d526a425e55660bf3eaf3cdfc9a4f4b8980c103",
      "checkedAt": "2026-10-25T01:15:38.993Z"
    },
    {
      "url": "https://docs.stripe.com/changelog/endive/2026-09-30/polymorphic-billing-cycle-anchor.md",
      "kind": "changelog",
      "trustBasis": "official-domain",
      "quote": "The `billing_cycle_anchor` field now requires an object with a `type` field instead of a string value (for example, `{type: 'now'}`). When creating a preview invoice, the [subscription_details.billing_cycle_anchor](https://docs.stripe.com/api/invoices/create_preview.md?api-version=2026-09-30.endive#create_invoice-subscription_details-billing_cycle_anchor) field requires an object with `type` and `timestamp` fields.",
      "contentHash": "2d0bbab67d57f572b0e7c7ae207984b0fa2ff26079e13faf40ae06674cb17522",
      "checkedAt": "2026-10-25T01:15:40.491Z"
    }
  ],
  "provenance": {
    "method": "table",
    "confidence": {
      "overall": 1
    }
  },
  "visibility": "public",
  "status": "confirmed",
  "quarantineReasons": []
}
