{
  "schemaVersion": 2,
  "id": "google-gemini-2026-10-22-veo-3-1-lite-generate-preview",
  "subject": {
    "kind": "model",
    "name": "veo-3.1-lite-generate-preview",
    "provider": "google-gemini"
  },
  "kind": "model-retirement",
  "title": "veo-3.1-lite-generate-preview shutdown",
  "summary": "Veo models. Shutdown date: 2026-10-22. Replacement: gemini-omni-1.1-flash.",
  "applicability": {
    "class": "already-broken",
    "fixedIn": [],
    "announcedOn": null,
    "effectiveOn": "2026-10-22"
  },
  "signatures": [
    {
      "kind": "string-literal",
      "value": "veo-3.1-lite-generate-preview",
      "context": "llm-call-arg"
    }
  ],
  "replacement": {
    "value": "gemini-omni-1.1-flash",
    "modelIds": ["gemini-omni-1.1-flash"],
    "codemod": {
      "kind": "model-swap",
      "spec": {
        "from": ["veo-3.1-lite-generate-preview"],
        "to": "gemini-omni-1.1-flash"
      }
    }
  },
  "migrationNotes": [],
  "sources": [
    {
      "url": "https://ai.google.dev/gemini-api/docs/deprecations.md.txt",
      "kind": "provider-table",
      "trustBasis": "official-domain",
      "quote": "| `veo-3.1-lite-generate-preview` | March 31, 2026 | October 22, 2026 | `gemini-omni-1.1-flash` |",
      "contentHash": "3342ebac18090931abc3a2f58e42a07f2f1f4c7f411dc6587c4faf64831c4601",
      "checkedAt": "2026-10-25T01:15:36.779Z"
    }
  ],
  "provenance": {
    "method": "table",
    "confidence": {
      "overall": 1
    }
  },
  "visibility": "public",
  "status": "confirmed",
  "quarantineReasons": []
}
